domain,title,category,description
bbc.co.uk,BBC News,News,National broadcaster covering UK and world news
theguardian.com,The Guardian,News,Independent UK news outlet offering long-form investigations and commentary.
sky.com,Sky News,News,24-hour news provider with coverage of breaking stories and live reports.
metro.co.uk,Metro UK,News,Free UK newspaper with quick takes on daily events
independent.co.uk,The Independent,News,Digital-only news platform focused on UK politics
dailymail.co.uk,Daily Mail,News,Mass-market paper featuring UK gossip
mirror.co.uk,The Mirror,News,UK tabloid covering major crime
standard.co.uk,Evening Standard,London News,London-focused reporting on transport
lbc.co.uk,LBC Radio,News/Radio,Talk radio platform hosting debates on politics
cityam.com,City AM,London Business,Financial news with a focus on London’s business district and corporate developments.
reuters.com,Reuters,News,International wire service offering breaking financial and global news.
bloomberg.com,Bloomberg,Finance,Global markets reporting with emphasis on economic trends and corporate activity.
ft.com,Financial Times,Finance,International business newspaper known for in-depth analysis and professional reporting.
gov.uk,UK Government Portal,Government,Official government services including records
nhs.uk,NHS,Health,Public health information including symptom guidance
met.police.uk,Metropolitan Police,Government,Official site of London’s police service with statements
london.gov.uk,Mayor of London,Government,Information about London governance
tfl.gov.uk,Transport for London,Public Transport,Live updates on London transport
legislation.gov.uk,UK Legislation,Government,Database of UK laws
companieshouse.gov.uk,Companies House,Business Registry,Official register of UK companies and filing records.
nationalarchives.gov.uk,National Archives,Government,Historical and public record archives including documents and datasets.
citizensadvice.org.uk,Citizens Advice,Support Services,Guidance on legal rights
samaritans.org,Samaritans,Support Services,Confidential helpline and mental health resources for people in crisis.
crimestoppers-uk.org,Crimestoppers,Crime Prevention,Anonymous reporting service for crime and suspicious activity.
reddit.com,Reddit,Social,Community forum with discussions on every topic from news to fringe theories.
facebook.com,Facebook,Social,A global social network for personal profiles
instagram.com,Instagram,Social,Photo and media sharing platform popular with UK influencers and creatives.
twitter.com,Twitter/X,Social,Microblogging network heavily used for breaking news and UK commentary.
youtube.com,YouTube,Media,Video-sharing platform hosting everything from news clips to obscure content.
tripadvisor.co.uk,TripAdvisor,Travel,User reviews for hotels
timeout.com/london,TimeOut London,London Guide,Events
visitlondon.com,Visit London,Tourism,Official tourism guide to London including activities and landmarks.
londonist.com,Londonist,London Culture,Articles exploring London history
secretldn.com,Secret London,London Guide,Light entertainment site covering quirky events
mylondon.news,MyLondon,Local News,Local reporting across London boroughs including crime and community updates.
thelondoneer.com,The Londoneer,London Blog,Blog covering London travel tips
londonreviewofbooks.co.uk,London Review of Books,Culture,Long-form essays and cultural critique.
timeoutdoors.com,Time Outdoors,Activities,UK walking and outdoor activity guides.
nationaltrust.org.uk,National Trust,Heritage,Nature and heritage sites across the UK.
english-heritage.org.uk,English Heritage,Heritage,Information on UK castles
hidden-london.com,Hidden London,London History,Deep dives into abandoned stations
subbrit.org.uk,Subterranea Britannica,Urban Exploration,Research into underground and forgotten UK places.
abandonedbritain.com,Abandoned Britain,Urban Exploration,Photography and documentation of derelict UK locations.
darkhotels.co.uk,Dark Hotels,Travel Blog,Travel writing focused on unusual or unsettling UK stays and late-night experiences.
thelineofbestfit.com,Best Fit,Music,UK music journalism with album reviews and underground scene coverage.
mixmag.net,Mixmag,Music,Nightlife and club culture reporting with global DJ features.
ra.co,Resident Advisor,Music,Electronic music events
thequietus.com,The Quietus,Culture,Articles exploring music
theskeptic.org.uk,The Skeptic,Skepticism,UK publication addressing pseudoscience and unusual beliefs.
rationalwiki.org,RationalWiki,Skepticism,Wiki critiquing conspiracy theories and fringe ideas.
theblackvault.com,The Black Vault,Conspiracy,Declassified documents and FOIA releases on intelligence and government projects.
infowars.com,InfoWars,Conspiracy,Controversial US conspiracy site with fringe political commentary.
collective-evolution.com,Collective Evolution,Conspiracy,Alternative news site discussing perception
vigilantcitizen.com,Vigilant Citizen,Conspiracy/Culture,Articles interpreting media symbolism and unusual cultural phenomena.
londonmystery.uk,London Mystery,Urban Legends,Articles on unexplained London tales
fogandlantern.co.uk,Fog & Lantern,Dark Culture UK,Essays on folklore
theundergroundmap.com,Underground Map,History,Hobbyist research site mapping hidden tunnels
urban75.net,Urban75,Forum,Long-running UK forum discussing politics
aboveetopsecret.com,AboveTopSecret,Conspiracy Forum,International forum discussing global conspiracies and unexplained events.
godlikeproductions.com,GLP Forum,Conspiracy Forum,Online forum covering political rumours
mumsnet.com,Mumsnet,Forum,Popular UK forum discussing family issues
tapatalk.com,Tapatalk Forums,Forum,Home of thousands of niche discussion forums including UK-local groups.
pistonheads.com,PistonHeads,Forum,UK automotive forum often discussing travel
quora.com,Quora,Knowledge Forum,Community question-and-answer site on any topic.
stackexchange.com,StackExchange,Knowledge Network,Technical and niche Q&A communities.
theoccultarchive.org,Occult Archive,Archive,Digital archive of historical esoteric texts and folklore materials.
nightfolk.uk,Nightfolk UK,Culture,Community blog collecting strange anecdotes
shadowatlas.co.uk,Shadow Atlas,Dark Culture,Independent journalism exploring crime history
psychogeographic.co.uk,The Psychogeographer,Culture,Articles exploring London’s emotional landscapes and hidden patterns of movement.
nowherejournal.com,Nowhere Journal,Literary Magazine,Creative nonfiction and strange travel writing with UK contributors.
weirdwalk.co.uk,Weird Walk,Folklore,UK folklore-inspired publication covering strange traditions and sites.
atlasobscura.com,Atlas Obscura,Travel,Global guide to unusual attractions
roadsidebritain.uk,Roadside Britain,Travel Blog,Documentation of strange roadside attractions and forgotten infrastructure.
fresheatlondon.com,Fresh Eat London,Restaurant Blog,Blog featuring London dining
derelictlondon.com,Derelict London,Urban Exploration,Photos and notes on abandoned buildings and decaying sites across London.
thelondonpsych.com,The London Psych,Analysis,Essays mixing culture
ukcolumn.org,UK Column,Alt News,Independent political commentary site covering UK government and civil issues.
truepublica.org.uk,TruePublica,Alt News,Investigative site covering corruption
byline.com,Byline,Investigations,Independent journalists publishing investigative work and commentary.
thecanary.co,The Canary,Alt News,Political reporting
vice.com,VICE,Youth Culture,News and documentary content often exploring fringe UK scenes.
thetab.com,The Tab,Youth Culture,University-focused reporting including scandals
londoncrime.uk,London Crime Watch,Crime Data,Public aggregator of London crime reports and neighbourhood statistics.
openstreetmap.org,OpenStreetMap,Mapping,User-generated maps with detailed UK street-level features.
maps.co.uk,Maps UK,Mapping,Public mapping and local area information including attractions.
weather.com,Weather Channel,Weather,Weather forecasts and alerts for UK towns and cities.
metoffice.gov.uk,Met Office,Weather,Official UK weather warnings
londonfire.gov.uk,London Fire Brigade,Public Safety,Fire safety updates and incident responses from the LFB.
thameswater.co.uk,Thames Water,Utilities,Water supply updates
ukpowernetworks.co.uk,UK Power Networks,Utilities,Electricity network updates
trainline.com,Trainline,Transport,UK rail booking platform with live service data.
nationalrail.co.uk,National Rail,Transport,Train times
arriva.co.uk,Arriva UK,Transport,Buses and transport updates with service news across UK regions.
uber.com,Uber UK,Transport,Private hire and ride-share services in London and major cities.
lyft.co.uk,Lyft UK,Transport,Ride-share platform with UK coverage.
booking.com,Booking.com,Travel,Hotel search platform used heavily for London tourism.
airbnb.co.uk,Airbnb UK,Travel,Private accommodation and short stays across London and the UK.
zoopla.co.uk,Zoopla,Property,Property listings and neighbourhood information across the UK.
rightmove.co.uk,Rightmove,Property,Housing market listings and valuation tools for UK regions.
gumtree.com,Gumtree,Classifieds,Listings for jobs
indeed.co.uk,Indeed UK,Jobs,Job search engine aggregating UK postings across industries.
totaljobs.com,TotalJobs,Jobs,Recruitment portal for UK businesses and applicants.
reed.co.uk,Reed UK,Jobs,Job search
thetrainyard.uk,The Trainyard,London Blog,Blog exploring industrial locations
nightbuschronicle.co.uk,Night Bus Chronicle,Culture/Blog,Stories and essays about late-night travel
publicrecordfinder.uk,Public Record Finder,Data Tools,Directory of UK public record sources and data lookups.
mysticsisters.co.uk,Mystic Sisters London,local business,"A long-running London-based psychic and tarot reading service offering phone, email, and in-person consultations."
psychicstudies.org,The College of Psychic Studies London,educational organisation,"Established centre in South Kensington offering courses, lectures, and workshops on psychic and spiritual development."
theatlantisbookshop.com,The Atlantis Bookshop London,bookshop,"Historic occult bookshop in Bloomsbury specialising in esotericism, magic, astrology, and spiritual texts."
watkinsbooks.com,Watkins Books London,bookshop & events,"Independent esoteric bookshop hosting talks and readings on mysticism, psychology, and spiritual practice."
timeout.com,Time Out London – Psychic Readings,media article,"Time Out guide covering psychic readings, tarot readers, and spiritual services across London."
jessicaadams.com,Jessica Adams Astrology,astrology service,"Well-known astrologer offering forecasts, consultations, and commentary frequently referenced in UK media."
trustpilot.com,Trustpilot – Psychic Reading Services,review platform,"Consumer reviews and ratings for online and in-person psychic reading services operating in the UK."
reddit.com,Reddit r/psychics,online community,"Discussion forum where users share experiences, recommendations, and skepticism about psychic readings and practices."
parapsych.org,Parapsychological Association,academic organisation,"International scholarly body focused on the scientific study of psychic and anomalous phenomena."
bbc.com,BBC Future – Can Psychics Really Predict?,media article,"Exploratory BBC article examining claims of psychic ability through psychology and science."
eventbrite.co.uk,Psychic & Tarot Events London,event listings,"Listings for tarot nights, psychic fairs, and spiritual workshops hosted across London venues."
houseofintuitionla.com,House of Intuition,retail & services,"Spiritual retail chain offering tarot readings, crystals, and metaphysical services with a growing UK presence."
bps.org.uk,British Psychological Society – Paranormal Belief,research articles,"Academic resources discussing belief in psychic phenomena from a psychological perspective."
yell.com,Psychics in London,business directory,"Local directory listing professional psychic readers, clairvoyants, and spiritual advisors in London."
theguardian.com,The Guardian – Astrology and Psychic Columns,newspaper column,"Opinion and lifestyle pieces exploring astrology, horoscopes, and modern spiritual belief."
abovetopsecret.com,Psychic Phenomena Forum Threads,discussion forum,"Long-running conspiracy and paranormal forum with extensive threads on psychic experiences."
treadwells-london.com,Treadwell’s Books London,bookshop & events,"Occult-focused bookshop near Covent Garden offering lectures, readings, and specialist texts."
psychicreadings.uk,Psychic Readings London UK,service aggregator,"Aggregator site advertising phone and online psychic readings from multiple UK-based practitioners."
mindbodyspiritfestival.co.uk,Mind Body Spirit Festival London,festival & expo,"Large annual wellness and spirituality event featuring psychic readers, talks, and holistic products."
wikipedia.org,Psychic Reading – Wikipedia,reference article,"Overview article describing psychic reading practices, history, skepticism, and cultural impact."



